OSS_project/tvm/conv2d.log
{"input": ["cuda -keys=cuda,gpu -max_num_threads=1024 -thread_warp_size=32", "tutorial/conv2d_no_batching", [1, 7, 7, 512, 512, 3, 3, [1, 1], [1, 1]], {}], "config": {"index": 3837972, "code_hash": null, "entity": [["tile_f", "sp", [-1, 1, 4, 2]], ["tile_y", "sp", [-1, 7, 1, 1]], ["tile_x", "sp", [-1, 7, 1, 1]], ["tile_rc", "sp", [-1, 1, 64]], ["tile_ry", "sp", [-1, 3, 1]], ["tile_rx", "sp", [-1, 1, 1]], ["auto_unroll_max_step", "ot", 1500], ["unroll_explicit", "ot", 0]]}, "result": [[0.025106241333333335], 0, 11.818543910980225, 1594554324.346677], "version": 0.2, "tvm_version": "0.7.dev1"}
{"input": ["cuda -keys=cuda,gpu -max_num_threads=1024 -thread_warp_size=32", "tutorial/conv2d_no_batching", [1, 7, 7, 512, 512, 3, 3, [1, 1], [1, 1]], {}], "config": {"index": 3004495, "code_hash": null, "entity": [["tile_f", "sp", [-1, 1, 4, 16]], ["tile_y", "sp", [-1, 1, 1, 1]], ["tile_x", "sp", [-1, 1, 7, 1]], ["tile_rc", "sp", [-1, 2, 8]], ["tile_ry", "sp", [-1, 1, 1]], ["tile_rx", "sp", [-1, 1, 3]], ["auto_unroll_max_step", "ot", 512], ["unroll_explicit", "ot", 0]]}, "result": [[0.0066463601875], 0, 9.912181377410889, 1594554325.676626], "version": 0.2, "tvm_version": "0.7.dev1"}
{"input": ["cuda -keys=cuda,gpu -max_num_threads=1024 -thread_warp_size=32", "tutorial/conv2d_no_batching", [1, 7, 7, 512, 512, 3, 3, [1, 1], [1, 1]], {}], "config": {"index": 9503022, "code_hash": null, "entity": [["tile_f", "sp", [-1, 2, 8, 4]], ["tile_y", "sp", [-1, 1, 1, 7]], ["tile_x", "sp", [-1, 1, 7, 1]], ["tile_rc", "sp", [-1, 16, 1]], ["tile_ry", "sp", [-1, 3, 1]], ["tile_rx", "sp", [-1, 3, 1]], ["auto_unroll_max_step", "ot", 1500], ["unroll_explicit", "ot", 1]]}, "result": [[0.0006551978376623377], 0, 9.497310876846313, 1594554326.52178], "version": 0.2, "tvm_version": "0.7.dev1"}
{"input": ["cuda -keys=cuda,gpu -max_num_threads=1024 -thread_warp_size=32", "tutorial/conv2d_no_batching", [1, 7, 7, 512, 512, 3, 3, [1, 1], [1, 1]], {}], "config": {"index": 9912249, "code_hash": null, "entity": [["tile_f", "sp", [-1, 1, 4, 8]], ["tile_y", "sp", [-1, 1, 1, 7]], ["tile_x", "sp", [-1, 1, 1, 7]], ["tile_rc", "sp", [-1, 1, 2]], ["tile_ry", "sp", [-1, 1, 1]], ["tile_rx", "sp", [-1, 1, 3]], ["auto_unroll_max_step", "ot", 1500], ["unroll_explicit", "ot", 1]]}, "result": [[0.019298330666666665], 0, 10.03725004196167, 1594554327.6002817], "version": 0.2, "tvm_version": "0.7.dev1"}
{"input": ["cuda -keys=cuda,gpu -max_num_threads=1024 -thread_warp_size=32", "tutorial/conv2d_no_batching", [1, 7, 7, 512, 512, 3, 3, [1, 1], [1, 1]], {}], "config": {"index": 7180603, "code_hash": null, "entity": [["tile_f", "sp", [-1, 16, 4, 1]], ["tile_y", "sp", [-1, 1, 1, 7]], ["tile_x", "sp", [-1, 1, 1, 7]], ["tile_rc", "sp", [-1, 16, 1]], ["tile_ry", "sp", [-1, 3, 1]], ["tile_rx", "sp", [-1, 1, 1]], ["auto_unroll_max_step", "ot", 512], ["unroll_explicit", "ot", 1]]}, "result": [[0.1229969655], 0, 10.671284198760986, 1594554329.6759622], "version": 0.2, "tvm_version": "0.7.dev1"}
{"input": ["cuda -keys=cuda,gpu -max_num_threads=1024 -thread_warp_size=32", "tutorial/conv2d_no_batching", [1, 7, 7, 512, 512, 3, 3, [1, 1], [1, 1]], {}], "config": {"index": 9683629, "code_hash": null, "entity": [["tile_f", "sp", [-1, 2, 2, 4]], ["tile_y", "sp", [-1, 1, 1, 1]], ["tile_x", "sp", [-1, 1, 1, 1]], ["tile_rc", "sp", [-1, 2, 1]], ["tile_ry", "sp", [-1, 1, 3]], ["tile_rx", "sp", [-1, 3, 1]], ["auto_unroll_max_step", "ot", 1500], ["unroll_explicit", "ot", 1]]}, "result": [[0.007563748333333333], 0, 1.273456335067749, 1594554331.724395], "version": 0.2, "tvm_version": "0.7.dev1"}
{"input": ["cuda -keys=cuda,gpu -max_num_threads=1024 -thread_warp_size=32", "tutorial/conv2d_no_batching", [1, 7, 7, 512, 512, 3, 3, [1, 1], [1, 1]], {}], "config": {"index": 3368274, "code_hash": null, "entity": [["tile_f", "sp", [-1, 4, 4, 2]], ["tile_y", "sp", [-1, 1, 7, 1]], ["tile_x", "sp", [-1, 1, 1, 7]], ["tile_rc", "sp", [-1, 4, 4]], ["tile_ry", "sp", [-1, 1, 3]], ["tile_rx", "sp", [-1, 1, 3]], ["auto_unroll_max_step", "ot", 512], ["unroll_explicit", "ot", 0]]}, "result": [[0.0038955797692307695], 0, 2.4201056957244873, 1594554333.2295947], "version": 0.2, "tvm_version": "0.7.dev1"}
{"input": ["cuda -keys=cuda,gpu -max_num_threads=1024 -thread_warp_size=32", "tutorial/conv2d_no_batching", [1, 7, 7, 512, 512, 3, 3, [1, 1], [1, 1]], {}], "config": {"index": 3562428, "code_hash": null, "entity": [["tile_f", "sp", [-1, 8, 1, 32]], ["tile_y", "sp", [-1, 1, 1, 1]], ["tile_x", "sp", [-1, 1, 1, 1]], ["tile_rc", "sp", [-1, 8, 4]], ["tile_ry", "sp", [-1, 1, 1]], ["tile_rx", "sp", [-1, 1, 1]], ["auto_unroll_max_step", "ot", 1500], ["unroll_explicit", "ot", 0]]}, "result": [[0.26472201625], 0, 5.51435399055481, 1594554532.9299495], "version": 0.2, "tvm_version": "0.7.dev1"}
{"input": ["cuda -keys=cuda,gpu -max_num_threads=1024 -thread_warp_size=32", "tutorial/conv2d_no_batching", [1, 7, 7, 512, 512, 3, 3, [1, 1], [1, 1]], {}], "config": {"index": 8813458, "code_hash": null, "entity": [["tile_f", "sp", [-1, 16, 16, 1]], ["tile_y", "sp", [-1, 7, 1, 1]], ["tile_x", "sp", [-1, 1, 1, 7]], ["tile_rc", "sp", [-1, 2, 8]], ["tile_ry", "sp", [-1, 1, 1]], ["tile_rx", "sp", [-1, 1, 1]], ["auto_unroll_max_step", "ot", 1500], ["unroll_explicit", "ot", 1]]}, "result": [[0.0459357145], 0, 6.077926158905029, 1594554534.4950538], "version": 0.2, "tvm_version": "0.7.dev1"}
{"input": ["cuda -keys=cuda,gpu -max_num_threads=1024 -thread_warp_size=32", "tutorial/conv2d_no_batching", [1, 7, 7, 512, 512, 3, 3, [1, 1], [1, 1]], {}], "config": {"index": 6877266, "code_hash": null, "entity": [["tile_f", "sp", [-1, 4, 2, 2]], ["tile_y", "sp", [-1, 1, 1, 1]], ["tile_x", "sp", [-1, 1, 1, 7]], ["tile_rc", "sp", [-1, 2, 8]], ["tile_ry", "sp", [-1, 1, 3]], ["tile_rx", "sp", [-1, 1, 3]], ["auto_unroll_max_step", "ot", 0], ["unroll_explicit", "ot", 1]]}, "result": [[0.024755605666666666], 0, 1.8013017177581787, 1594554535.5126479], "version": 0.2, "tvm_version": "0.7.dev1"}
{"input": ["cuda -keys=cuda,gpu -max_num_threads=1024 -thread_warp_size=32", "tutorial/conv2d_no_batching", [1, 7, 7, 512, 512, 3, 3, [1, 1], [1, 1]], {}], "config": {"index": 8871955, "code_hash": null, "entity": [["tile_f", "sp", [-1, 32, 2, 1]], ["tile_y", "sp", [-1, 1, 1, 7]], ["tile_x", "sp", [-1, 7, 1, 1]], ["tile_rc", "sp", [-1, 1, 64]], ["tile_ry", "sp", [-1, 1, 1]], ["tile_rx", "sp", [-1, 1, 1]], ["auto_unroll_max_step", "ot", 1500], ["unroll_explicit", "ot", 1]]}, "result": [[0.1222399175], 0, 3.3348679542541504, 1594554537.5872142], "version": 0.2, "tvm_version": "0.7.dev1"}
{"input": ["cuda -keys=cuda,gpu -max_num_threads=1024 -thread_warp_size=32", "tutorial/conv2d_no_batching", [1, 7, 7, 512, 512, 3, 3, [1, 1], [1, 1]], {}], "config": {"index": 7047766, "code_hash": null, "entity": [["tile_f", "sp", [-1, 4, 2, 2]], ["tile_y", "sp", [-1, 1, 1, 7]], ["tile_x", "sp", [-1, 1, 1, 1]], ["tile_rc", "sp", [-1, 8, 4]], ["tile_ry", "sp", [-1, 1, 1]], ["tile_rx", "sp", [-1, 1, 1]], ["auto_unroll_max_step", "ot", 512], ["unroll_explicit", "ot", 1]]}, "result": [[0.0020198815098039216], 0, 1.8873722553253174, 1594554545.6508424], "version": 0.2, "tvm_version": "0.7.dev1"}
{"input": ["cuda -keys=cuda,gpu -max_num_threads=1024 -thread_warp_size=32", "tutorial/conv2d_no_batching", [1, 7, 7, 512, 512, 3, 3, [1, 1], [1, 1]], {}], "config": {"index": 3177349, "code_hash": null, "entity": [["tile_f", "sp", [-1, 2, 2, 4]], ["tile_y", "sp", [-1, 1, 7, 1]], ["tile_x", "sp", [-1, 1, 7, 1]], ["tile_rc", "sp", [-1, 8, 4]], ["tile_ry", "sp", [-1, 3, 1]], ["tile_rx", "sp", [-1, 1, 3]], ["auto_unroll_max_step", "ot", 512], ["unroll_explicit", "ot", 0]]}, "result": [[0.001315618417721519], 0, 1.3228230476379395, 1594554546.5594416], "version": 0.2, "tvm_version": "0.7.dev1"}
{"input": ["cuda -keys=cuda,gpu -max_num_threads=1024 -thread_warp_size=32", "tutorial/conv2d_no_batching", [1, 7, 7, 512, 512, 3, 3, [1, 1], [1, 1]], {}], "config": {"index": 206724, "code_hash": null, "entity": [["tile_f", "sp", [-1, 2, 2, 8]], ["tile_y", "sp", [-1, 1, 1, 7]], ["tile_x", "sp", [-1, 1, 7, 1]], ["tile_rc", "sp", [-1, 8, 1]], ["tile_ry", "sp", [-1, 3, 1]], ["tile_rx", "sp", [-1, 1, 1]], ["auto_unroll_max_step", "ot", 0], ["unroll_explicit", "ot", 0]]}, "result": [[0.0033437653333333334], 0, 1.1466708183288574, 1594554547.5114043], "version": 0.2, "tvm_version": "0.7.dev1"}
{"input": ["cuda -keys=cuda,gpu -max_num_threads=1024 -thread_warp_size=32", "tutorial/conv2d_no_batching", [1, 7, 7, 512, 512, 3, 3, [1, 1], [1, 1]], {}], "config": {"index": 4264837, "code_hash": null, "entity": [["tile_f", "sp", [-1, 2, 1, 8]], ["tile_y", "sp", [-1, 7, 1, 1]], ["tile_x", "sp", [-1, 1, 7, 1]], ["tile_rc", "sp", [-1, 2, 1]], ["tile_ry", "sp", [-1, 3, 1]], ["tile_rx", "sp", [-1, 3, 1]], ["auto_unroll_max_step", "ot", 1500], ["unroll_explicit", "ot", 0]]}, "result": [[0.005086179904761905], 0, 1.3897242546081543, 1594554552.3160303], "version": 0.2, "tvm_version": "0.7.dev1"}
{"input": ["cuda -keys=cuda,gpu -max_num_threads=1024 -thread_warp_size=32", "tutorial/conv2d_no_batching", [1, 7, 7, 512, 512, 3, 3, [1, 1], [1, 1]], {}], "config": {"index": 3776639, "code_hash": null, "entity": [["tile_f", "sp", [-1, 16, 4, 4]], ["tile_y", "sp", [-1, 1, 7, 1]], ["tile_x", "sp", [-1, 1, 1, 7]], ["tile_rc", "sp", [-1, 1, 8]], ["tile_ry", "sp", [-1, 3, 1]], ["tile_rx", "sp", [-1, 1, 1]], ["auto_unroll_max_step", "ot", 1500], ["unroll_explicit", "ot", 0]]}, "result": [[0.0387651185], 0, 7.726853132247925, 1594554556.418599], "version": 0.2, "tvm_version": "0.7.dev1"}
{"input": ["cuda -keys=cuda,gpu -max_num_threads=1024 -thread_warp_size=32", "tutorial/conv2d_no_batching", [1, 7, 7, 512, 512, 3, 3, [1, 1], [1, 1]], {}], "config": {"index": 2337137, "code_hash": null, "entity": [["tile_f", "sp", [-1, 32, 4, 2]], ["tile_y", "sp", [-1, 1, 1, 7]], ["tile_x", "sp", [-1, 1, 1, 7]], ["tile_rc", "sp", [-1, 8, 1]], ["tile_ry", "sp", [-1, 1, 1]], ["tile_rx", "sp", [-1, 3, 1]], ["auto_unroll_max_step", "ot", 512], ["unroll_explicit", "ot", 0]]}, "result": [[0.10470241725], 0, 3.152251958847046, 1594554558.3389776], "version": 0.2, "tvm_version": "0.7.dev1"}
{"input": ["cuda -keys=cuda,gpu -max_num_threads=1024 -thread_warp_size=32", "tutorial/conv2d_no_batching", [1, 7, 7, 512, 512, 3, 3, [1, 1], [1, 1]], {}], "config": {"index": 231593, "code_hash": null, "entity": [["tile_f", "sp", [-1, 16, 4, 8]], ["tile_y", "sp", [-1, 1, 1, 1]], ["tile_x", "sp", [-1, 1, 1, 7]], ["tile_rc", "sp", [-1, 1, 2]], ["tile_ry", "sp", [-1, 3, 1]], ["tile_rx", "sp", [-1, 1, 1]], ["auto_unroll_max_step", "ot", 0], ["unroll_explicit", "ot", 0]]}, "result": [[0.0650761275], 0, 1.9515380859375, 1594554559.7227821], "version": 0.2, "tvm_version": "0.7.dev1"}
{"input": ["cuda -keys=cuda,gpu -max_num_threads=1024 -thread_warp_size=32", "tutorial/conv2d_no_batching", [1, 7, 7, 512, 512, 3, 3, [1, 1], [1, 1]], {}], "config": {"index": 6290582, "code_hash": null, "entity": [["tile_f", "sp", [-1, 2, 8, 4]], ["tile_y", "sp", [-1, 7, 1, 1]], ["tile_x", "sp", [-1, 1, 1, 1]], ["tile_rc", "sp", [-1, 1, 8]], ["tile_ry", "sp", [-1, 1, 3]], ["tile_rx", "sp", [-1, 3, 1]], ["auto_unroll_max_step", "ot", 0], ["unroll_explicit", "ot", 1]]}, "result": [[0.005462643157894737], 0, 1.3652443885803223, 1594554560.5363953], "version": 0.2, "tvm_version": "0.7.dev1"}
{"input": ["cuda -keys=cuda,gpu -max_num_threads=1024 -thread_warp_size=32", "tutorial/conv2d_no_batching", [1, 7, 7, 512, 512, 3, 3, [1, 1], [1, 1]], {}], "config": {"index": 7175760, "code_hash": null, "entity": [["tile_f", "sp", [-1, 2, 4, 1]], ["tile_y", "sp", [-1, 7, 1, 1]], ["tile_x", "sp", [-1, 1, 7, 1]], ["tile_rc", "sp", [-1, 8, 1]], ["tile_ry", "sp", [-1, 3, 1]], ["tile_rx", "sp", [-1, 1, 1]], ["auto_unroll_max_step", "ot", 512], ["unroll_explicit", "ot", 1]]}, "result": [[0.0002930034248554913], 0, 0.8786296844482422, 1594554561.952736], "version": 0.2, "tvm_version": "0.7.dev1"}
{"input": ["cuda -keys=cuda,gpu -max_num_threads=1024 -thread_warp_size=32", "tutorial/conv2d_no_batching", [1, 7, 7, 512, 512, 3, 3, [1, 1], [1, 1]], {}], "config": {"index": 240495, "code_hash": null, "entity": [["tile_f", "sp", [-1, 2, 16, 1]], ["tile_y", "sp", [-1, 7, 1, 1]], ["tile_x", "sp", [-1, 7, 1, 1]], ["tile_rc", "sp", [-1, 8, 2]], ["tile_ry", "sp", [-1, 3, 1]], ["tile_rx", "sp", [-1, 1, 1]], ["auto_unroll_max_step", "ot", 0], ["unroll_explicit", "ot", 0]]}, "result": [[0.0008575601538461539], 0, 1.721484899520874, 1594554590.066907], "version": 0.2, "tvm_version": "0.7.dev1"}
{"input": ["cuda -keys=cuda,gpu -max_num_threads=1024 -thread_warp_size=32", "tutorial/conv2d_no_batching", [1, 7, 7, 512, 512, 3, 3, [1, 1], [1, 1]], {}], "config": {"index": 240700, "code_hash": null, "entity": [["tile_f", "sp", [-1, 2, 4, 1]], ["tile_y", "sp", [-1, 1, 7, 1]], ["tile_x", "sp", [-1, 7, 1, 1]], ["tile_rc", "sp", [-1, 8, 2]], ["tile_ry", "sp", [-1, 3, 1]], ["tile_rx", "sp", [-1, 1, 1]], ["auto_unroll_max_step", "ot", 0], ["unroll_explicit", "ot", 0]]}, "result": [[0.0005644631328671328], 0, 1.3794536590576172, 1594554590.963514], "version": 0.2, "tvm_version": "0.7.dev1"}
{"input": ["cuda -keys=cuda,gpu -max_num_threads=1024 -thread_warp_size=32", "tutorial/conv2d_no_batching", [1, 7, 7, 512, 512, 3, 3, [1, 1], [1, 1]], {}], "config": {"index": 656113, "code_hash": null, "entity": [["tile_f", "sp", [-1, 2, 4, 2]], ["tile_y", "sp", [-1, 1, 7, 1]], ["tile_x", "sp", [-1, 7, 1, 1]], ["tile_rc", "sp", [-1, 4, 4]], ["tile_ry", "sp", [-1, 1, 1]], ["tile_rx", "sp", [-1, 3, 1]], ["auto_unroll_max_step", "ot", 0], ["unroll_explicit", "ot", 0]]}, "result": [[0.001279519835443038], 0, 1.2760722637176514, 1594554591.6800995], "version": 0.2, "tvm_version": "0.7.dev1"}
{"input": ["cuda -keys=cuda,gpu -max_num_threads=1024 -thread_warp_size=32", "tutorial/conv2d_no_batching", [1, 7, 7, 512, 512, 3, 3, [1, 1], [1, 1]], {}], "config": {"index": 2034241, "code_hash": null, "entity": [["tile_f", "sp", [-1, 1, 8, 4]], ["tile_y", "sp", [-1, 1, 7, 1]], ["tile_x", "sp", [-1, 1, 1, 7]], ["tile_rc", "sp", [-1, 1, 8]], ["tile_ry", "sp", [-1, 3, 1]], ["tile_rx", "sp", [-1, 1, 1]], ["auto_unroll_max_step", "ot", 512], ["unroll_explicit", "ot", 0]]}, "result": [[0.000796672746031746], 0, 1.3268852233886719, 1594554592.3742259], "version": 0.2, "tvm_version": "0.7.dev1"}
{"input": ["cuda -keys=cuda,gpu -max_num_threads=1024 -thread_warp_size=32", "tutorial/conv2d_no_batching", [1, 7, 7, 512, 512, 3, 3, [1, 1], [1, 1]], {}], "config": {"index": 1812262, "code_hash": null, "entity": [["tile_f", "sp", [-1, 2, 8, 4]], ["tile_y", "sp", [-1, 7, 1, 1]], ["tile_x", "sp", [-1, 1, 1, 7]], ["tile_rc", "sp", [-1, 1, 4]], ["tile_ry", "sp", [-1, 1, 1]], ["tile_rx", "sp", [-1, 1, 1]], ["auto_unroll_max_step", "ot", 512], ["unroll_explicit", "ot", 0]]}, "result": [[0.029297054], 0, 2.3825130462646484, 1594554593.36039], "version": 0.2, "tvm_version": "0.7.dev1"}
{"input": ["cuda -keys=cuda,gpu -max_num_threads=1024 -thread_warp_size=32", "tutorial/conv2d_no_batching", [1, 7, 7, 512, 512, 3, 3, [1, 1], [1, 1]], {}], "config": {"index": 1784106, "code_hash": null, "entity": [["tile_f", "sp", [-1, 1, 16, 4]], ["tile_y", "sp", [-1, 7, 1, 1]], ["tile_x", "sp", [-1, 1, 1, 7]], ["tile_rc", "sp", [-1, 2, 2]], ["tile_ry", "sp", [-1, 1, 1]], ["tile_rx", "sp", [-1, 1, 1]], ["auto_unroll_max_step", "ot", 512], ["unroll_explicit", "ot", 0]]}, "result": [[0.008574136833333334], 0, 1.829702615737915, 1594554594.371684], "version": 0.2, "tvm_version": "0.7.dev1"}
{"input": ["cuda -keys=cuda,gpu -max_num_threads=1024 -thread_warp_size=32", "tutorial/conv2d_no_batching", [1, 7, 7, 512, 512, 3, 3, [1, 1], [1, 1]], {}], "config": {"index": 1810502, "code_hash": null, "entity": [["tile_f", "sp", [-1, 2, 8, 4]], ["tile_y", "sp", [-1, 7, 1, 1]], ["tile_x", "sp", [-1, 7, 1, 1]], ["tile_rc", "sp", [-1, 1, 4]], ["tile_ry", "sp", [-1, 1, 1]], ["tile_rx", "sp", [-1, 1, 1]], ["auto_unroll_max_step", "ot", 512], ["unroll_explicit", "ot", 0]]}, "result": [[0.02994343], 0, 2.588473320007324, 1594554595.5158567], "version": 0.2, "tvm_version": "0.7.dev1"}
{"input": ["cuda -keys=cuda,gpu -max_num_threads=1024 -thread_warp_size=32", "tutorial/conv2d_no_batching", [1, 7, 7, 512, 512, 3, 3, [1, 1], [1, 1]], {}], "config": {"index": 5429215, "code_hash": null, "entity": [["tile_f", "sp", [-1, 1, 1, 2]], ["tile_y", "sp", [-1, 1, 7, 1]], ["tile_x", "sp", [-1, 7, 1, 1]], ["tile_rc", "sp", [-1, 4, 1]], ["tile_ry", "sp", [-1, 3, 1]], ["tile_rx", "sp", [-1, 1, 1]], ["auto_unroll_max_step", "ot", 0], ["unroll_explicit", "ot", 1]]}, "result": [[0.0008612913333333333], 0, 1.2374119758605957, 1594554596.229178], "version": 0.2, "tvm_version": "0.7.dev1"}
{"input": ["cuda -keys=cuda,gpu -max_num_threads=1024 -thread_warp_size=32", "tutorial/conv2d_no_batching", [1, 7, 7, 512, 512, 3, 3, [1, 1], [1, 1]], {}], "config": {"index": 3493219, "code_hash": null, "entity": [["tile_f", "sp", [-1, 16, 1, 2]], ["tile_y", "sp", [-1, 1, 7, 1]], ["tile_x", "sp", [-1, 7, 1, 1]], ["tile_rc", "sp", [-1, 4, 1]], ["tile_ry", "sp", [-1, 1, 1]], ["tile_rx", "sp", [-1, 1, 1]], ["auto_unroll_max_step", "ot", 1500], ["unroll_explicit", "ot", 0]]}, "result": [[0.00515880445], 0, 1.7508819103240967, 1594554597.085908], "version": 0.2, "tvm_version": "0.7.dev1"}
{"input": ["cuda -keys=cuda,gpu -max_num_threads=1024 -thread_warp_size=32", "tutorial/conv2d_no_batching", [1, 7, 7, 512, 512, 3, 3, [1, 1], [1, 1]], {}], "config": {"index": 2141780, "code_hash": null, "entity": [["tile_f", "sp", [-1, 2, 8, 2]], ["tile_y", "sp", [-1, 1, 1, 7]], ["tile_x", "sp", [-1, 7, 1, 1]], ["tile_rc", "sp", [-1, 8, 1]], ["tile_ry", "sp", [-1, 1, 3]], ["tile_rx", "sp", [-1, 1, 1]], ["auto_unroll_max_step", "ot", 512], ["unroll_explicit", "ot", 0]]}, "result": [[0.0036922264285714286], 0, 1.754641056060791, 1594554597.8727822], "version": 0.2, "tvm_version": "0.7.dev1"}
{"input": ["cuda -keys=cuda,gpu -max_num_threads=1024 -thread_warp_size=32", "tutorial/conv2d_no_batching", [1, 7, 7, 512, 512, 3, 3, [1, 1], [1, 1]], {}], "config": {"index": 2137851, "code_hash": null, "entity": [["tile_f", "sp", [-1, 8, 2, 4]], ["tile_y", "sp", [-1, 7, 1, 1]], ["tile_x", "sp", [-1, 7, 1, 1]], ["tile_rc", "sp", [-1, 4, 1]], ["tile_ry", "sp", [-1, 1, 3]], ["tile_rx", "sp", [-1, 1, 1]], ["auto_unroll_max_step", "ot", 512], ["unroll_explicit", "ot", 0]]}, "result": [[0.14192412325], 0, 6.763592958450317, 1594554600.3879902], "version": 0.2, "tvm_version": "0.7.dev1"}
{"input": ["cuda -keys=cuda,gpu -max_num_threads=1024 -thread_warp_size=32", "tutorial/conv2d_no_batching", [1, 7, 7, 512, 512, 3, 3, [1, 1], [1, 1]], {}], "config": {"index": 1979421, "code_hash": null, "entity": [["tile_f", "sp", [-1, 4, 8, 2]], ["tile_y", "sp", [-1, 7, 1, 1]], ["tile_x", "sp", [-1, 7, 1, 1]], ["tile_rc", "sp", [-1, 4, 2]], ["tile_ry", "sp", [-1, 3, 1]], ["tile_rx", "sp", [-1, 1, 1]], ["auto_unroll_max_step", "ot", 512], ["unroll_explicit", "ot", 0]]}, "result": [[0.01412911125], 0, 2.6877663135528564, 1594554601.3833354], "version": 0.2, "tvm_version": "0.7.dev1"}
{"input": ["cuda -keys=cuda,gpu -max_num_threads=1024 -thread_warp_size=32", "tutorial/conv2d_no_batching", [1, 7, 7, 512, 512, 3, 3, [1, 1], [1, 1]], {}], "config": {"index": 3552902, "code_hash": null, "entity": [["tile_f", "sp", [-1, 2, 8, 4]], ["tile_y", "sp", [-1, 7, 1, 1]], ["tile_x", "sp", [-1, 7, 1, 1]], ["tile_rc", "sp", [-1, 1, 4]], ["tile_ry", "sp", [-1, 1, 1]], ["tile_rx", "sp", [-1, 1, 1]], ["auto_unroll_max_step", "ot", 1500], ["unroll_explicit", "ot", 0]]}, "result": [[0.02885411175], 0, 1.9824767112731934, 1594554602.0687444], "version": 0.2, "tvm_version": "0.7.dev1"}
{"input": ["cuda -keys=cuda,gpu -max_num_threads=1024 -thread_warp_size=32", "tutorial/conv2d_no_batching", [1, 7, 7, 512, 512, 3, 3, [1, 1], [1, 1]], {}], "config": {"index": 5654583, "code_hash": null, "entity": [["tile_f", "sp", [-1, 1, 2, 8]], ["tile_y", "sp", [-1, 1, 7, 1]], ["tile_x", "sp", [-1, 7, 1, 1]], ["tile_rc", "sp", [-1, 2, 2]], ["tile_ry", "sp", [-1, 1, 3]], ["tile_rx", "sp", [-1, 1, 1]], ["auto_unroll_max_step", "ot", 0], ["unroll_explicit", "ot", 1]]}, "result": [[0.0016177249365079366], 0, 1.2709691524505615, 1594554602.7598944], "version": 0.2, "tvm_version": "0.7.dev1"}
{"input": ["cuda -keys=cuda,gpu -max_num_threads=1024 -thread_warp_size=32", "tutorial/conv2d_no_batching", [1, 7, 7, 512, 512, 3, 3, [1, 1], [1, 1]], {}], "config": {"index": 2171306, "code_hash": null, "entity": [["tile_f", "sp", [-1, 1, 16, 4]], ["tile_y", "sp", [-1, 7, 1, 1]], ["tile_x", "sp", [-1, 1, 1, 7]], ["tile_rc", "sp", [-1, 2, 2]], ["tile_ry", "sp", [-1, 1, 3]], ["tile_rx", "sp", [-1, 1, 1]], ["auto_unroll_max_step", "ot", 512], ["unroll_explicit", "ot", 0]]}, "result": [[0.005725698888888889], 0, 1.7278854846954346, 1594554603.5388215], "version": 0.2, "tvm_version": "0.7.dev1"}
{"input": ["cuda -keys=cuda,gpu -max_num_threads=1024 -thread_warp_size=32", "tutorial/conv2d_no_batching", [1, 7, 7, 512, 512, 3, 3, [1, 1], [1, 1]], {}], "config": {"index": 5877821, "code_hash": null, "entity": [["tile_f", "sp", [-1, 4, 8, 2]], ["tile_y", "sp", [-1, 7, 1, 1]], ["tile_x", "sp", [-1, 1, 1, 7]], ["tile_rc", "sp", [-1, 1, 4]], ["tile_ry", "sp", [-1, 1, 1]], ["tile_rx", "sp", [-1, 3, 1]], ["auto_unroll_max_step", "ot", 0], ["unroll_explicit", "ot", 1]]}, "result": [[0.0508620705], 0, 2.580853223800659, 1594554604.657784], "version": 0.2, "tvm_version": "0.7.dev1"}
{"input": ["cuda -keys=cuda,gpu -max_num_threads=1024 -thread_warp_size=32", "tutorial/conv2d_no_batching", [1, 7, 7, 512, 512, 3, 3, [1, 1], [1, 1]], {}], "config": {"index": 5462488, "code_hash": null, "entity": [["tile_f", "sp", [-1, 1, 2, 4]], ["tile_y", "sp", [-1, 7, 1, 1]], ["tile_x", "sp", [-1, 1, 1, 7]], ["tile_rc", "sp", [-1, 2, 2]], ["tile_ry", "sp", [-1, 3, 1]], ["tile_rx", "sp", [-1, 1, 1]], ["auto_unroll_max_step", "ot", 0], ["unroll_explicit", "ot", 1]]}, "result": [[0.0486463315], 0, 2.3958077430725098, 1594554610.856457], "version": 0.2, "tvm_version": "0.7.dev1"}
{"input": ["cuda -keys=cuda,gpu -max_num_threads=1024 -thread_warp_size=32", "tutorial/conv2d_no_batching", [1, 7, 7, 512, 512, 3, 3, [1, 1], [1, 1]], {}], "config": {"index": 4654819, "code_hash": null, "entity": [["tile_f", "sp", [-1, 16, 1, 2]], ["tile_y", "sp", [-1, 1, 7, 1]], ["tile_x", "sp", [-1, 7, 1, 1]], ["tile_rc", "sp", [-1, 4, 1]], ["tile_ry", "sp", [-1, 1, 1]], ["tile_rx", "sp", [-1, 1, 3]], ["auto_unroll_max_step", "ot", 1500], ["unroll_explicit", "ot", 0]]}, "result": [[0.0099657450625], 0, 2.5174896717071533, 1594554612.1296482], "version": 0.2, "tvm_version": "0.7.dev1"}
{"input": ["cuda -keys=cuda,gpu -max_num_threads=1024 -thread_warp_size=32", "tutorial/conv2d_no_batching", [1, 7, 7, 512, 512, 3, 3, [1, 1], [1, 1]], {}], "config": {"index": 3525115, "code_hash": null, "entity": [["tile_f", "sp", [-1, 1, 1, 2]], ["tile_y", "sp", [-1, 1, 1, 7]], ["tile_x", "sp", [-1, 7, 1, 1]], ["tile_rc", "sp", [-1, 2, 2]], ["tile_ry", "sp", [-1, 1, 1]], ["tile_rx", "sp", [-1, 1, 1]], ["auto_unroll_max_step", "ot", 1500], ["unroll_explicit", "ot", 0]]}, "result": [[0.020225138333333333], 0, 2.1912646293640137, 1594554613.1953082], "version": 0.2, "tvm_version": "0.7.dev1"}
{"input": ["cuda -keys=cuda,gpu -max_num_threads=1024 -thread_warp_size=32", "tutorial/conv2d_no_batching", [1, 7, 7, 512, 512, 3, 3, [1, 1], [1, 1]], {}], "config": {"index": 5816206, "code_hash": null, "entity": [["tile_f", "sp", [-1, 4, 2, 2]], ["tile_y", "sp", [-1, 7, 1, 1]], ["tile_x", "sp", [-1, 7, 1, 1]], ["tile_rc", "sp", [-1, 4, 1]], ["tile_ry", "sp", [-1, 1, 1]], ["tile_rx", "sp", [-1, 3, 1]], ["auto_unroll_max_step", "ot", 0], ["unroll_explicit", "ot", 1]]}, "result": [[0.040953945], 0, 2.908478021621704, 1594554614.3484013], "version": 0.2, "tvm_version": "0.7.dev1"}
{"input": ["cuda -keys=cuda,gpu -max_num_threads=1024 -thread_warp_size=32", "tutorial/conv2d_no_batching", [1, 7, 7, 512, 512, 3, 3, [1, 1], [1, 1]], {}], "config": {"index": 4134142, "code_hash": null, "entity": [["tile_f", "sp", [-1, 2, 8, 4]], ["tile_y", "sp", [-1, 1, 1, 7]], ["tile_x", "sp", [-1, 7, 1, 1]], ["tile_rc", "sp", [-1, 1, 4]], ["tile_ry", "sp", [-1, 1, 1]], ["tile_rx", "sp", [-1, 3, 1]], ["auto_unroll_max_step", "ot", 1500], ["unroll_explicit", "ot", 0]]}, "result": [[0.0260324655], 0, 2.555551528930664, 1594554615.3183763], "version": 0.2, "tvm_version": "0.7.dev1"}
{"input": ["cuda -keys=cuda,gpu -max_num_threads=1024 -thread_warp_size=32", "tutorial/conv2d_no_batching", [1, 7, 7, 512, 512, 3, 3, [1, 1], [1, 1]], {}], "config": {"index": 7173180, "code_hash": null, "entity": [["tile_f", "sp", [-1, 2, 8, 2]], ["tile_y", "sp", [-1, 7, 1, 1]], ["tile_x", "sp", [-1, 1, 1, 7]], ["tile_rc", "sp", [-1, 4, 1]], ["tile_ry", "sp", [-1, 3, 1]], ["tile_rx", "sp", [-1, 1, 1]], ["auto_unroll_max_step", "ot", 512], ["unroll_explicit", "ot", 1]]}, "result": [[0.004347556081081081], 0, 2.4132635593414307, 1594554616.5674834], "version": 0.2, "tvm_version": "0.7.dev1"}
{"input": ["cuda -keys=cuda,gpu -max_num_threads=1024 -thread_warp_size=32", "tutorial/conv2d_no_batching", [1, 7, 7, 512, 512, 3, 3, [1, 1], [1, 1]], {}], "config": {"index": 2363534, "code_hash": null, "entity": [["tile_f", "sp", [-1, 4, 4, 2]], ["tile_y", "sp", [-1, 1, 1, 7]], ["tile_x", "sp", [-1, 7, 1, 1]], ["tile_rc", "sp", [-1, 2, 2]], ["tile_ry", "sp", [-1, 1, 1]], ["tile_rx", "sp", [-1, 3, 1]], ["auto_unroll_max_step", "ot", 512], ["unroll_explicit", "ot", 0]]}, "result": [[0.020798257333333334], 0, 2.4784419536590576, 1594554617.6440651], "version": 0.2, "tvm_version": "0.7.dev1"}
{"input": ["cuda -keys=cuda,gpu -max_num_threads=1024 -thread_warp_size=32", "tutorial/conv2d_no_batching", [1, 7, 7, 512, 512, 3, 3, [1, 1], [1, 1]], {}], "config": {"index": 5816221, "code_hash": null, "entity": [["tile_f", "sp", [-1, 4, 8, 2]], ["tile_y", "sp", [-1, 7, 1, 1]], ["tile_x", "sp", [-1, 7, 1, 1]], ["tile_rc", "sp", [-1, 4, 1]], ["tile_ry", "sp", [-1, 1, 1]], ["tile_rx", "sp", [-1, 3, 1]], ["auto_unroll_max_step", "ot", 0], ["unroll_explicit", "ot", 1]]}, "result": [[0.0199035755], 0, 2.643629789352417, 1594554618.681116], "version": 0.2, "tvm_version": "0.7.dev1"}
{"input": ["cuda -keys=cuda,gpu -max_num_threads=1024 -thread_warp_size=32", "tutorial/conv2d_no_batching", [1, 7, 7, 512, 512, 3, 3, [1, 1], [1, 1]], {}], "config": {"index": 5237347, "code_hash": null, "entity": [["tile_f", "sp", [-1, 1, 8, 1]], ["tile_y", "sp", [-1, 1, 7, 1]], ["tile_x", "sp", [-1, 1, 1, 7]], ["tile_rc", "sp", [-1, 4, 1]], ["tile_ry", "sp", [-1, 1, 1]], ["tile_rx", "sp", [-1, 1, 1]], ["auto_unroll_max_step", "ot", 0], ["unroll_explicit", "ot", 1]]}, "result": [[0.0008722915897435898], 0, 1.2864925861358643, 1594554619.3960867], "version": 0.2, "tvm_version": "0.7.dev1"}
{"input": ["cuda -keys=cuda,gpu -max_num_threads=1024 -thread_warp_size=32", "tutorial/conv2d_no_batching", [1, 7, 7, 512, 512, 3, 3, [1, 1], [1, 1]], {}], "config": {"index": 3880251, "code_hash": null, "entity": [["tile_f", "sp", [-1, 8, 2, 4]], ["tile_y", "sp", [-1, 7, 1, 1]], ["tile_x", "sp", [-1, 7, 1, 1]], ["tile_rc", "sp", [-1, 4, 1]], ["tile_ry", "sp", [-1, 1, 3]], ["tile_rx", "sp", [-1, 1, 1]], ["auto_unroll_max_step", "ot", 1500], ["unroll_explicit", "ot", 0]]}, "result": [[0.14277592825], 0, 6.570939540863037, 1594554621.5700948], "version": 0.2, "tvm_version": "0.7.dev1"}
{"input": ["cuda -keys=cuda,gpu -max_num_threads=1024 -thread_warp_size=32", "tutorial/conv2d_no_batching", [1, 7, 7, 512, 512, 3, 3, [1, 1], [1, 1]], {}], "config": {"index": 3692108, "code_hash": null, "entity": [["tile_f", "sp", [-1, 16, 2, 2]], ["tile_y", "sp", [-1, 1, 7, 1]], ["tile_x", "sp", [-1, 1, 1, 7]], ["tile_rc", "sp", [-1, 8, 1]], ["tile_ry", "sp", [-1, 3, 1]], ["tile_rx", "sp", [-1, 1, 1]], ["auto_unroll_max_step", "ot", 1500], ["unroll_explicit", "ot", 0]]}, "result": [[0.011341578444444445], 0, 3.2250852584838867, 1594554623.0818706], "version": 0.2, "tvm_version": "0.7.dev1"}
{"input": ["cuda -keys=cuda,gpu -max_num_threads=1024 -thread_warp_size=32", "tutorial/conv2d_no_batching", [1, 7, 7, 512, 512, 3, 3, [1, 1], [1, 1]], {}], "config": {"index": 6398808, "code_hash": null, "entity": [["tile_f", "sp", [-1, 1, 2, 4]], ["tile_y", "sp", [-1, 7, 1, 1]], ["tile_x", "sp", [-1, 1, 1, 7]], ["tile_rc", "sp", [-1, 4, 1]], ["tile_ry", "sp", [-1, 1, 1]], ["tile_rx", "sp", [-1, 1, 3]], ["auto_unroll_max_step", "ot", 0], ["unroll_explicit", "ot", 1]]}, "result": [[0.007278875285714285], 0, 1.7107701301574707, 1594554623.927724], "version": 0.2, "tvm_version": "0.7.dev1"}
{"input": ["cuda -keys=cuda,gpu -max_num_threads=1024 -thread_warp_size=32", "tutorial/conv2d_no_batching", [1, 7, 7, 512, 512, 3, 3, [1, 1], [1, 1]], {}], "config": {"index": 7205068, "code_hash": null, "entity": [["tile_f", "sp", [-1, 16, 2, 2]], ["tile_y", "sp", [-1, 1, 7, 1]], ["tile_x", "sp", [-1, 1, 1, 7]], ["tile_rc", "sp", [-1, 2, 2]], ["tile_ry", "sp", [-1, 3, 1]], ["tile_rx", "sp", [-1, 1, 1]], ["auto_unroll_max_step", "ot", 512], ["unroll_explicit", "ot", 1]]}, "result": [[0.006559599875], 0, 2.3044991493225098, 1594554624.847178], "version": 0.2, "tvm_version": "0.7.dev1"}
{"input": ["cuda -keys=cuda,gpu -max_num_threads=1024 -thread_warp_size=32", "tutorial/conv2d_no_batching", [1, 7, 7, 512, 512, 3, 3, [1, 1], [1, 1]], {}], "config": {"index": 4264932, "code_hash": null, "entity": [["tile_f", "sp", [-1, 4, 2, 1]], ["tile_y", "sp", [-1, 1, 7, 1]], ["tile_x", "sp", [-1, 1, 7, 1]], ["tile_rc", "sp", [-1, 2, 1]], ["tile_ry", "sp", [-1, 3, 1]], ["tile_rx", "sp", [-1, 3, 1]], ["auto_unroll_max_step", "ot", 1500], ["unroll_explicit", "ot", 0]]}, "result": [[0.00036726997491039426], 0, 1.1967387199401855, 1594554625.5157473], "version": 0.2, "tvm_version": "0.7.dev1"}
{"input": ["cuda -keys=cuda,gpu -max_num_threads=1024 -thread_warp_size=32", "tutorial/conv2d_no_batching", [1, 7, 7, 512, 512, 3, 3, [1, 1], [1, 1]], {}], "config": {"index": 3554662, "code_hash": null, "entity": [["tile_f", "sp", [-1, 2, 8, 4]], ["tile_y", "sp", [-1, 7, 1, 1]], ["tile_x", "sp", [-1, 1, 1, 7]], ["tile_rc", "sp", [-1, 1, 4]], ["tile_ry", "sp", [-1, 1, 1]], ["tile_rx", "sp", [-1, 1, 1]], ["auto_unroll_max_step", "ot", 1500], ["unroll_explicit", "ot", 0]]}, "result": [[0.0298029575], 0, 2.075119972229004, 1594554626.249815], "version": 0.2, "tvm_version": "0.7.dev1"}
{"input": ["cuda -keys=cuda,gpu -max_num_threads=1024 -thread_warp_size=32", "tutorial/conv2d_no_batching", [1, 7, 7, 512, 512, 3, 3, [1, 1], [1, 1]], {}], "config": {"index": 9492132, "code_hash": null, "entity": [["tile_f", "sp", [-1, 4, 2, 1]], ["tile_y", "sp", [-1, 1, 7, 1]], ["tile_x", "sp", [-1, 1, 7, 1]], ["tile_rc", "sp", [-1, 2, 1]], ["tile_ry", "sp", [-1, 3, 1]], ["tile_rx", "sp", [-1, 3, 1]], ["auto_unroll_max_step", "ot", 1500], ["unroll_explicit", "ot", 1]]}, "result": [[0.00035627505605381163], 0, 1.568612813949585, 1594554627.226991], "version": 0.2, "tvm_version": "0.7.dev1"}
{"input": ["cuda -keys=cuda,gpu -max_num_threads=1024 -thread_warp_size=32", "tutorial/conv2d_no_batching", [1, 7, 7, 512, 512, 3, 3, [1, 1], [1, 1]], {}], "config": {"index": 8977428, "code_hash": null, "entity": [["tile_f", "sp", [-1, 1, 2, 4]], ["tile_y", "sp", [-1, 1, 7, 1]], ["tile_x", "sp", [-1, 7, 1, 1]], ["tile_rc", "sp", [-1, 2, 4]], ["tile_ry", "sp", [-1, 3, 1]], ["tile_rx", "sp", [-1, 1, 1]], ["auto_unroll_max_step", "ot", 1500], ["unroll_explicit", "ot", 1]]}, "result": [[0.00040459977911646585], 0, 2.307732343673706, 1594554631.8032336], "version": 0.2, "tvm_version": "0.7.dev1"}
{"input": ["cuda -keys=cuda,gpu -max_num_threads=1024 -thread_warp_size=32", "tutorial/conv2d_no_batching", [1, 7, 7, 512, 512, 3, 3, [1, 1], [1, 1]], {}], "config": {"index": 5883313, "code_hash": null, "entity": [["tile_f", "sp", [-1, 2, 4, 2]], ["tile_y", "sp", [-1, 1, 7, 1]], ["tile_x", "sp", [-1, 7, 1, 1]], ["tile_rc", "sp", [-1, 4, 4]], ["tile_ry", "sp", [-1, 1, 1]], ["tile_rx", "sp", [-1, 3, 1]], ["auto_unroll_max_step", "ot", 0], ["unroll_explicit", "ot", 1]]}, "result": [[0.001277332329113924], 0, 1.2040126323699951, 1594554632.4297452], "version": 0.2, "tvm_version": "0.7.dev1"}
{"input": ["cuda -keys=cuda,gpu -max_num_threads=1024 -thread_warp_size=32", "tutorial/conv2d_no_batching", [1, 7, 7, 512, 512, 3, 3, [1, 1], [1, 1]], {}], "config": {"index": 9362621, "code_hash": null, "entity": [["tile_f", "sp", [-1, 4, 8, 2]], ["tile_y", "sp", [-1, 7, 1, 1]], ["tile_x", "sp", [-1, 1, 1, 7]], ["tile_rc", "sp", [-1, 1, 4]], ["tile_ry", "sp", [-1, 1, 1]], ["tile_rx", "sp", [-1, 3, 1]], ["auto_unroll_max_step", "ot", 1500], ["unroll_explicit", "ot", 1]]}, "result": [[0.024408895833333333], 0, 3.4062986373901367, 1594554633.5879223], "version": 0.2, "tvm_version": "0.7.dev1"}
{"input": ["cuda -keys=cuda,gpu -max_num_threads=1024 -thread_warp_size=32", "tutorial/conv2d_no_batching", [1, 7, 7, 512, 512, 3, 3, [1, 1], [1, 1]], {}], "config": {"index": 5878035, "code_hash": null, "entity": [["tile_f", "sp", [-1, 8, 4, 2]], ["tile_y", "sp", [-1, 1, 7, 1]], ["tile_x", "sp", [-1, 1, 1, 7]], ["tile_rc", "sp", [-1, 1, 4]], ["tile_ry", "sp", [-1, 1, 1]], ["tile_rx", "sp", [-1, 3, 1]], ["auto_unroll_max_step", "ot", 0], ["unroll_explicit", "ot", 1]]}, "result": [[0.004007501461538462], 0, 1.4777579307556152, 1594554634.3422773], "version": 0.2, "tvm_version": "0.7.dev1"}
{"input": ["cuda -keys=cuda,gpu -max_num_threads=1024 -thread_warp_size=32", "tutorial/conv2d_no_batching", [1, 7, 7, 512, 512, 3, 3, [1, 1], [1, 1]], {}], "config": {"index": 8752315, "code_hash": null, "entity": [["tile_f", "sp", [-1, 1, 1, 2]], ["tile_y", "sp", [-1, 1, 1, 7]], ["tile_x", "sp", [-1, 7, 1, 1]], ["tile_rc", "sp", [-1, 2, 2]], ["tile_ry", "sp", [-1, 1, 1]], ["tile_rx", "sp", [-1, 1, 1]], ["auto_unroll_max_step", "ot", 1500], ["unroll_explicit", "ot", 1]]}, "result": [[0.009321049181818182], 0, 2.16725754737854, 1594554635.133831], "version": 0.2, "tvm_version": "0.7.dev1"}
{"input": ["cuda -keys=cuda,gpu -max_num_threads=1024 -thread_warp_size=32", "tutorial/conv2d_no_batching", [1, 7, 7, 512, 512, 3, 3, [1, 1], [1, 1]], {}], "config": {"index": 5429496, "code_hash": null, "entity": [["tile_f", "sp", [-1, 2, 4, 4]], ["tile_y", "sp", [-1, 1, 1, 7]], ["tile_x", "sp", [-1, 7, 1, 1]], ["tile_rc", "sp", [-1, 4, 1]], ["tile_ry", "sp", [-1, 3, 1]], ["tile_rx", "sp", [-1, 1, 1]], ["auto_unroll_max_step", "ot", 0], ["unroll_explicit", "ot", 1]]}, "result": [[0.09216690525], 0, 2.660423994064331, 1594554636.7394996], "version": 0.2, "tvm_version": "0.7.dev1"}
{"input": ["cuda -keys=cuda,gpu -max_num_threads=1024 -thread_warp_size=32", "tutorial/conv2d_no_batching", [1, 7, 7, 512, 512, 3, 3, [1, 1], [1, 1]], {}], "config": {"index": 4079100, "code_hash": null, "entity": [["tile_f", "sp", [-1, 2, 8, 2]], ["tile_y", "sp", [-1, 7, 1, 1]], ["tile_x", "sp", [-1, 1, 1, 7]], ["tile_rc", "sp", [-1, 8, 1]], ["tile_ry", "sp", [-1, 1, 1]], ["tile_rx", "sp", [-1, 3, 1]], ["auto_unroll_max_step", "ot", 1500], ["unroll_explicit", "ot", 0]]}, "result": [[0.0013002987215189874], 0, 1.7745401859283447, 1594554637.5026605], "version": 0.2, "tvm_version": "0.7.dev1"}
{"input": ["cuda -keys=cuda,gpu -max_num_threads=1024 -thread_warp_size=32", "tutorial/conv2d_no_batching", [1, 7, 7, 512, 512, 3, 3, [1, 1], [1, 1]], {}], "config": {"index": 8722147, "code_hash": null, "entity": [["tile_f", "sp", [-1, 1, 8, 1]], ["tile_y", "sp", [-1, 1, 7, 1]], ["tile_x", "sp", [-1, 1, 1, 7]], ["tile_rc", "sp", [-1, 4, 1]], ["tile_ry", "sp", [-1, 1, 1]], ["tile_rx", "sp", [-1, 1, 1]], ["auto_unroll_max_step", "ot", 1500], ["unroll_explicit", "ot", 1]]}, "result": [[0.0008549917731092438], 0, 1.7263598442077637, 1594554638.2544775], "version": 0.2, "tvm_version": "0.7.dev1"}
{"input": ["cuda -keys=cuda,gpu -max_num_threads=1024 -thread_warp_size=32", "tutorial/conv2d_no_batching", [1, 7, 7, 512, 512, 3, 3, [1, 1], [1, 1]], {}], "config": {"index": 8722008, "code_hash": null, "entity": [["tile_f", "sp", [-1, 1, 2, 4]], ["tile_y", "sp", [-1, 7, 1, 1]], ["tile_x", "sp", [-1, 1, 1, 7]], ["tile_rc", "sp", [-1, 4, 1]], ["tile_ry", "sp", [-1, 1, 1]], ["tile_rx", "sp", [-1, 1, 1]], ["auto_unroll_max_step", "ot", 1500], ["unroll_explicit", "ot", 1]]}, "result": [[0.002873036942857143], 0, 2.5342586040496826, 1594554639.0457776], "version": 0.2, "tvm_version": "0.7.dev1"}
{"input": ["cuda -keys=cuda,gpu -max_num_threads=1024 -thread_warp_size=32", "tutorial/conv2d_no_batching", [1, 7, 7, 512, 512, 3, 3, [1, 1], [1, 1]], {}], "config": {"index": 7590734, "code_hash": null, "entity": [["tile_f", "sp", [-1, 4, 4, 2]], ["tile_y", "sp", [-1, 1, 1, 7]], ["tile_x", "sp", [-1, 7, 1, 1]], ["tile_rc", "sp", [-1, 2, 2]], ["tile_ry", "sp", [-1, 1, 1]], ["tile_rx", "sp", [-1, 3, 1]], ["auto_unroll_max_step", "ot", 512], ["unroll_explicit", "ot", 1]]}, "result": [[0.0201251055], 0, 2.906503915786743, 1594554640.0635347], "version": 0.2, "tvm_version": "0.7.dev1"}
{"input": ["cuda -keys=cuda,gpu -max_num_threads=1024 -thread_warp_size=32", "tutorial/conv2d_no_batching", [1, 7, 7, 512, 512, 3, 3, [1, 1], [1, 1]], {}], "config": {"index": 8947468, "code_hash": null, "entity": [["tile_f", "sp", [-1, 16, 2, 2]], ["tile_y", "sp", [-1, 1, 7, 1]], ["tile_x", "sp", [-1, 1, 1, 7]], ["tile_rc", "sp", [-1, 2, 2]], ["tile_ry", "sp", [-1, 3, 1]], ["tile_rx", "sp", [-1, 1, 1]], ["auto_unroll_max_step", "ot", 1500], ["unroll_explicit", "ot", 1]]}, "result": [[0.0064587905], 0, 2.0296568870544434, 1594554640.7300427], "version": 0.2, "tvm_version": "0.7.dev1"}
{"input": ["cuda -keys=cuda,gpu -max_num_threads=1024 -thread_warp_size=32", "tutorial/conv2d_no_batching", [1, 7, 7, 512, 512, 3, 3, [1, 1], [1, 1]], {}], "config": {"index": 9882330, "code_hash": null, "entity": [["tile_f", "sp", [-1, 2, 4, 8]], ["tile_y", "sp", [-1, 1, 1, 7]], ["tile_x", "sp", [-1, 7, 1, 1]], ["tile_rc", "sp", [-1, 4, 1]], ["tile_ry", "sp", [-1, 1, 1]], ["tile_rx", "sp", [-1, 1, 3]], ["auto_unroll_max_step", "ot", 1500], ["unroll_explicit", "ot", 1]]}, "result": [[0.04841491775], 0, 4.842793226242065, 1594554642.114781], "version": 0.2, "tvm_version": "0.7.dev1"}
{"input": ["cuda -keys=cuda,gpu -max_num_threads=1024 -thread_warp_size=32", "tutorial/conv2d_no_batching", [1, 7, 7, 512, 512, 3, 3, [1, 1], [1, 1]], {}], "config": {"index": 7785874, "code_hash": null, "entity": [["tile_f", "sp", [-1, 4, 4, 2]], ["tile_y", "sp", [-1, 1, 7, 1]], ["tile_x", "sp", [-1, 1, 1, 7]], ["tile_rc", "sp", [-1, 2, 2]], ["tile_ry", "sp", [-1, 3, 1]], ["tile_rx", "sp", [-1, 3, 1]], ["auto_unroll_max_step", "ot", 512], ["unroll_explicit", "ot", 1]]}, "result": [[0.0008291210082644628], 0, 1.8341195583343506, 1594554642.842459], "version": 0.2, "tvm_version": "0.7.dev1"}
{"input": ["cuda -keys=cuda,gpu -max_num_threads=1024 -thread_warp_size=32", "tutorial/conv2d_no_batching", [1, 7, 7, 512, 512, 3, 3, [1, 1], [1, 1]], {}], "config": {"index": 10072932, "code_hash": null, "entity": [["tile_f", "sp", [-1, 4, 2, 1]], ["tile_y", "sp", [-1, 1, 7, 1]], ["tile_x", "sp", [-1, 1, 7, 1]], ["tile_rc", "sp", [-1, 2, 1]], ["tile_ry", "sp", [-1, 3, 1]], ["tile_rx", "sp", [-1, 1, 3]], ["auto_unroll_max_step", "ot", 1500], ["unroll_explicit", "ot", 1]]}, "result": [[0.0003663622471655329], 0, 1.5442543029785156, 1594554643.786364], "version": 0.2, "tvm_version": "0.7.dev1"}
{"input": ["cuda -keys=cuda,gpu -max_num_threads=1024 -thread_warp_size=32", "tutorial/conv2d_no_batching", [1, 7, 7, 512, 512, 3, 3, [1, 1], [1, 1]], {}], "config": {"index": 5430947, "code_hash": null, "entity": [["tile_f", "sp", [-1, 1, 8, 1]], ["tile_y", "sp", [-1, 1, 7, 1]], ["tile_x", "sp", [-1, 1, 1, 7]], ["tile_rc", "sp", [-1, 4, 1]], ["tile_ry", "sp", [-1, 3, 1]], ["tile_rx", "sp", [-1, 1, 1]], ["auto_unroll_max_step", "ot", 0], ["unroll_explicit", "ot", 1]]}, "result": [[0.0005071516168224299], 0, 1.6253819465637207, 1594554644.770681], "version": 0.2, "tvm_version": "0.7.dev1"}
{"input": ["cuda -keys=cuda,gpu -max_num_threads=1024 -thread_warp_size=32", "tutorial/conv2d_no_batching", [1, 7, 7, 512, 512, 3, 3, [1, 1], [1, 1]], {}], "config": {"index": 5816371, "code_hash": null, "entity": [["tile_f", "sp", [-1, 2, 2, 1]], ["tile_y", "sp", [-1, 1, 7, 1]], ["tile_x", "sp", [-1, 7, 1, 1]], ["tile_rc", "sp", [-1, 4, 1]], ["tile_ry", "sp", [-1, 1, 1]], ["tile_rx", "sp", [-1, 3, 1]], ["auto_unroll_max_step", "ot", 0], ["unroll_explicit", "ot", 1]]}, "result": [[0.0014521419857142857], 0, 1.3119609355926514, 1594554645.4389217], "version": 0.2, "tvm_version": "0.7.dev1"}
{"input": ["cuda -keys=cuda,gpu -max_num_threads=1024 -thread_warp_size=32", "tutorial/conv2d_no_batching", [1, 7, 7, 512, 512, 3, 3, [1, 1], [1, 1]], {}], "config": {"index": 8782135, "code_hash": null, "entity": [["tile_f", "sp", [-1, 1, 4, 16]], ["tile_y", "sp", [-1, 1, 7, 1]], ["tile_x", "sp", [-1, 1, 1, 7]], ["tile_rc", "sp", [-1, 1, 4]], ["tile_ry", "sp", [-1, 1, 1]], ["tile_rx", "sp", [-1, 1, 1]], ["auto_unroll_max_step", "ot", 1500], ["unroll_explicit", "ot", 1]]}, "result": [[0.0017165847288135591], 0, 1.9974479675292969, 1594554648.0606027], "version": 0.2, "tvm_version": "0.7.dev1"}
{"input": ["cuda -keys=cuda,gpu -max_num_threads=1024 -thread_warp_size=32", "tutorial/conv2d_no_batching", [1, 7, 7, 512, 512, 3, 3, [1, 1], [1, 1]], {}], "config": {"index": 7173347, "code_hash": null, "entity": [["tile_f", "sp", [-1, 1, 8, 1]], ["tile_y", "sp", [-1, 1, 7, 1]], ["tile_x", "sp", [-1, 1, 1, 7]], ["tile_rc", "sp", [-1, 4, 1]], ["tile_ry", "sp", [-1, 3, 1]], ["tile_rx", "sp", [-1, 1, 1]], ["auto_unroll_max_step", "ot", 512], ["unroll_explicit", "ot", 1]]}, "result": [[0.0004929521568627451], 0, 1.173919677734375, 1594554648.7388127], "version": 0.2, "tvm_version": "0.7.dev1"}
{"input": ["cuda -keys=cuda,gpu -max_num_threads=1024 -thread_warp_size=32", "tutorial/conv2d_no_batching", [1, 7, 7, 512, 512, 3, 3, [1, 1], [1, 1]], {}], "config": {"index": 9302808, "code_hash": null, "entity": [["tile_f", "sp", [-1, 1, 2, 4]], ["tile_y", "sp", [-1, 7, 1, 1]], ["tile_x", "sp", [-1, 1, 1, 7]], ["tile_rc", "sp", [-1, 4, 1]], ["tile_ry", "sp", [-1, 1, 1]], ["tile_rx", "sp", [-1, 3, 1]], ["auto_unroll_max_step", "ot", 1500], ["unroll_explicit", "ot", 1]]}, "result": [[0.0018660479761904763], 0, 2.270561695098877, 1594554649.7463489], "version": 0.2, "tvm_version": "0.7.dev1"}
{"input": ["cuda -keys=cuda,gpu -max_num_threads=1024 -thread_warp_size=32", "tutorial/conv2d_no_batching", [1, 7, 7, 512, 512, 3, 3, [1, 1], [1, 1]], {}], "config": {"index": 3884180, "code_hash": null, "entity": [["tile_f", "sp", [-1, 2, 8, 2]], ["tile_y", "sp", [-1, 1, 1, 7]], ["tile_x", "sp", [-1, 7, 1, 1]], ["tile_rc", "sp", [-1, 8, 1]], ["tile_ry", "sp", [-1, 1, 3]], ["tile_rx", "sp", [-1, 1, 1]], ["auto_unroll_max_step", "ot", 1500], ["unroll_explicit", "ot", 0]]}, "result": [[0.0011785865116279068], 0, 2.023313283920288, 1594554650.506339], "version": 0.2, "tvm_version": "0.7.dev1"}
{"input": ["cuda -keys=cuda,gpu -max_num_threads=1024 -thread_warp_size=32", "tutorial/conv2d_no_batching", [1, 7, 7, 512, 512, 3, 3, [1, 1], [1, 1]], {}], "config": {"index": 6043474, "code_hash": null, "entity": [["tile_f", "sp", [-1, 4, 4, 2]], ["tile_y", "sp", [-1, 1, 7, 1]], ["tile_x", "sp", [-1, 1, 1, 7]], ["tile_rc", "sp", [-1, 2, 2]], ["tile_ry", "sp", [-1, 3, 1]], ["tile_rx", "sp", [-1, 3, 1]], ["auto_unroll_max_step", "ot", 0], ["unroll_explicit", "ot", 1]]}, "result": [[0.002583177205128205], 0, 1.2506141662597656, 1594554651.2185416], "version": 0.2, "tvm_version": "0.7.dev1"}
{"input": ["cuda -keys=cuda,gpu -max_num_threads=1024 -thread_warp_size=32", "tutorial/conv2d_no_batching", [1, 7, 7, 512, 512, 3, 3, [1, 1], [1, 1]], {}], "config": {"index": 5268888, "code_hash": null, "entity": [["tile_f", "sp", [-1, 1, 2, 4]], ["tile_y", "sp", [-1, 7, 1, 1]], ["tile_x", "sp", [-1, 1, 1, 7]], ["tile_rc", "sp", [-1, 2, 2]], ["tile_ry", "sp", [-1, 1, 1]], ["tile_rx", "sp", [-1, 1, 1]], ["auto_unroll_max_step", "ot", 0], ["unroll_explicit", "ot", 1]]}, "result": [[0.02915329725], 0, 1.7798712253570557, 1594554652.1317239], "version": 0.2, "tvm_version": "0.7.dev1"}
{"input": ["cuda -keys=cuda,gpu -max_num_threads=1024 -thread_warp_size=32", "tutorial/conv2d_no_batching", [1, 7, 7, 512, 512, 3, 3, [1, 1], [1, 1]], {}], "config": {"index": 3721821, "code_hash": null, "entity": [["tile_f", "sp", [-1, 4, 8, 2]], ["tile_y", "sp", [-1, 7, 1, 1]], ["tile_x", "sp", [-1, 7, 1, 1]], ["tile_rc", "sp", [-1, 4, 2]], ["tile_ry", "sp", [-1, 3, 1]], ["tile_rx", "sp", [-1, 1, 1]], ["auto_unroll_max_step", "ot", 1500], ["unroll_explicit", "ot", 0]]}, "result": [[0.012441536222222223], 0, 2.801985502243042, 1594554653.3027787], "version": 0.2, "tvm_version": "0.7.dev1"}
{"input": ["cuda -keys=cuda,gpu -max_num_threads=1024 -thread_warp_size=32", "tutorial/conv2d_no_batching", [1, 7, 7, 512, 512, 3, 3, [1, 1], [1, 1]], {}], "config": {"index": 9882260, "code_hash": null, "entity": [["tile_f", "sp", [-1, 2, 8, 2]], ["tile_y", "sp", [-1, 1, 1, 7]], ["tile_x", "sp", [-1, 7, 1, 1]], ["tile_rc", "sp", [-1, 4, 1]], ["tile_ry", "sp", [-1, 1, 1]], ["tile_rx", "sp", [-1, 1, 3]], ["auto_unroll_max_step", "ot", 1500], ["unroll_explicit", "ot", 1]]}, "result": [[0.004466360695652174], 0, 2.1186273097991943, 1594554654.0981436], "version": 0.2, "tvm_version": "0.7.dev1"}
{"input": ["cuda -keys=cuda,gpu -max_num_threads=1024 -thread_warp_size=32", "tutorial/conv2d_no_batching", [1, 7, 7, 512, 512, 3, 3, [1, 1], [1, 1]], {}], "config": {"index": 7595527, "code_hash": null, "entity": [["tile_f", "sp", [-1, 1, 8, 1]], ["tile_y", "sp", [-1, 7, 1, 1]], ["tile_x", "sp", [-1, 1, 1, 7]], ["tile_rc", "sp", [-1, 4, 2]], ["tile_ry", "sp", [-1, 1, 1]], ["tile_rx", "sp", [-1, 3, 1]], ["auto_unroll_max_step", "ot", 512], ["unroll_explicit", "ot", 1]]}, "result": [[0.0012303486341463414], 0, 1.997753381729126, 1594554654.9868348], "version": 0.2, "tvm_version": "0.7.dev1"}
{"input": ["cuda -keys=cuda,gpu -max_num_threads=1024 -thread_warp_size=32", "tutorial/conv2d_no_batching", [1, 7, 7, 512, 512, 3, 3, [1, 1], [1, 1]], {}], "config": {"index": 8720419, "code_hash": null, "entity": [["tile_f", "sp", [-1, 16, 1, 2]], ["tile_y", "sp", [-1, 1, 7, 1]], ["tile_x", "sp", [-1, 7, 1, 1]], ["tile_rc", "sp", [-1, 4, 1]], ["tile_ry", "sp", [-1, 1, 1]], ["tile_rx", "sp", [-1, 1, 1]], ["auto_unroll_max_step", "ot", 1500], ["unroll_explicit", "ot", 1]]}, "result": [[0.0065741613125], 0, 2.3337936401367188, 1594554655.8391445], "version": 0.2, "tvm_version": "0.7.dev1"}
{"input": ["cuda -keys=cuda,gpu -max_num_threads=1024 -thread_warp_size=32", "tutorial/conv2d_no_batching", [1, 7, 7, 512, 512, 3, 3, [1, 1], [1, 1]], {}], "config": {"index": 9883608, "code_hash": null, "entity": [["tile_f", "sp", [-1, 1, 2, 4]], ["tile_y", "sp", [-1, 7, 1, 1]], ["tile_x", "sp", [-1, 1, 1, 7]], ["tile_rc", "sp", [-1, 4, 1]], ["tile_ry", "sp", [-1, 1, 1]], ["tile_rx", "sp", [-1, 1, 3]], ["auto_unroll_max_step", "ot", 1500], ["unroll_explicit", "ot", 1]]}, "result": [[0.0018502572470588236], 0, 2.20661997795105, 1594554656.8575745], "version": 0.2, "tvm_version": "0.7.dev1"}
{"input": ["cuda -keys=cuda,gpu -max_num_threads=1024 -thread_warp_size=32", "tutorial/conv2d_no_batching", [1, 7, 7, 512, 512, 3, 3, [1, 1], [1, 1]], {}], "config": {"index": 5816426, "code_hash": null, "entity": [["tile_f", "sp", [-1, 4, 2, 2]], ["tile_y", "sp", [-1, 1, 7, 1]], ["tile_x", "sp", [-1, 7, 1, 1]], ["tile_rc", "sp", [-1, 4, 1]], ["tile_ry", "sp", [-1, 1, 1]], ["tile_rx", "sp", [-1, 3, 1]], ["auto_unroll_max_step", "ot", 0], ["unroll_explicit", "ot", 1]]}, "result": [[0.0022874247272727274], 0, 1.251650333404541, 1594554657.5407584], "version": 0.2, "tvm_version": "0.7.dev1"}
{"input": ["cuda -keys=cuda,gpu -max_num_threads=1024 -thread_warp_size=32", "tutorial/conv2d_no_batching", [1, 7, 7, 512, 512, 3, 3, [1, 1], [1, 1]], {}], "config": {"index": 4656586, "code_hash": null, "entity": [["tile_f", "sp", [-1, 4, 2, 2]], ["tile_y", "sp", [-1, 1, 7, 1]], ["tile_x", "sp", [-1, 1, 1, 7]], ["tile_rc", "sp", [-1, 4, 1]], ["tile_ry", "sp", [-1, 1, 1]], ["tile_rx", "sp", [-1, 1, 3]], ["auto_unroll_max_step", "ot", 1500], ["unroll_explicit", "ot", 0]]}, "result": [[0.0024796942926829267], 0, 1.936253547668457, 1594554658.4284673], "version": 0.2, "tvm_version": "0.7.dev1"}
{"input": ["cuda -keys=cuda,gpu -max_num_threads=1024 -thread_warp_size=32", "tutorial/conv2d_no_batching", [1, 7, 7, 512, 512, 3, 3, [1, 1], [1, 1]], {}], "config": {"index": 3551967, "code_hash": null, "entity": [["tile_f", "sp", [-1, 8, 2, 2]], ["tile_y", "sp", [-1, 7, 1, 1]], ["tile_x", "sp", [-1, 1, 1, 1]], ["tile_rc", "sp", [-1, 1, 4]], ["tile_ry", "sp", [-1, 1, 1]], ["tile_rx", "sp", [-1, 1, 1]], ["auto_unroll_max_step", "ot", 1500], ["unroll_explicit", "ot", 0]]}, "result": [[0.003631386642857143], 0, 1.826148271560669, 1594554659.2630446], "version": 0.2, "tvm_version": "0.7.dev1"}
{"input": ["cuda -keys=cuda,gpu -max_num_threads=1024 -thread_warp_size=32", "tutorial/conv2d_no_batching", [1, 7, 7, 512, 512, 3, 3, [1, 1], [1, 1]], {}], "config": {"index": 4659224, "code_hash": null, "entity": [["tile_f", "sp", [-1, 1, 2, 2]], ["tile_y", "sp", [-1, 1, 7, 1]], ["tile_x", "sp", [-1, 1, 7, 1]], ["tile_rc", "sp", [-1, 8, 1]], ["tile_ry", "sp", [-1, 1, 1]], ["tile_rx", "sp", [-1, 1, 3]], ["auto_unroll_max_step", "ot", 1500], ["unroll_explicit", "ot", 0]]}, "result": [[0.0006313851116279069], 0, 1.5460360050201416, 1594554745.8705108], "version": 0.2, "tvm_version": "0.7.dev1"}
{"input": ["cuda -keys=cuda,gpu -max_num_threads=1024 -thread_warp_size=32", "tutorial/conv2d_no_batching", [1, 7, 7, 512, 512, 3, 3, [1, 1], [1, 1]], {}], "config": {"index": 1948567, "code_hash": null, "entity": [["tile_f", "sp", [-1, 1, 8, 1]], ["tile_y", "sp", [-1, 7, 1, 1]], ["tile_x", "sp", [-1, 1, 7, 1]], ["tile_rc", "sp", [-1, 8, 1]], ["tile_ry", "sp", [-1, 3, 1]], ["tile_rx", "sp", [-1, 1, 1]], ["auto_unroll_max_step", "ot", 512], ["unroll_explicit", "ot", 0]]}, "result": [[0.00041168161068702293], 0, 1.6191258430480957, 1594554746.9118085], "version": 0.2, "tvm_version": "0.7.dev1"}
{"input": ["cuda -keys=cuda,gpu -max_num_threads=1024 -thread_warp_size=32", "tutorial/conv2d_no_batching", [1, 7, 7, 512, 512, 3, 3, [1, 1], [1, 1]], {}], "config": {"index": 2916824, "code_hash": null, "entity": [["tile_f", "sp", [-1, 1, 2, 2]], ["tile_y", "sp", [-1, 1, 7, 1]], ["tile_x", "sp", [-1, 1, 7, 1]], ["tile_rc", "sp", [-1, 8, 1]], ["tile_ry", "sp", [-1, 1, 1]], ["tile_rx", "sp", [-1, 1, 3]], ["auto_unroll_max_step", "ot", 512], ["unroll_explicit", "ot", 0]]}, "result": [[0.0006192894320987655], 0, 1.308276891708374, 1594554747.5681353], "version": 0.2, "tvm_version": "0.7.dev1"}
{"input": ["cuda -keys=cuda,gpu -max_num_threads=1024 -thread_warp_size=32", "tutorial/conv2d_no_batching", [1, 7, 7, 512, 512, 3, 3, [1, 1], [1, 1]], {}], "config": {"index": 2723179, "code_hash": null, "entity": [["tile_f", "sp", [-1, 1, 4, 1]], ["tile_y", "sp", [-1, 1, 7, 1]], ["tile_x", "sp", [-1, 1, 7, 1]], ["tile_rc", "sp", [-1, 8, 1]], ["tile_ry", "sp", [-1, 1, 3]], ["tile_rx", "sp", [-1, 3, 1]], ["auto_unroll_max_step", "ot", 512], ["unroll_explicit", "ot", 0]]}, "result": [[0.0007421974050000001], 0, 1.5305535793304443, 1594554748.5026104], "version": 0.2, "tvm_version": "0.7.dev1"}
{"input": ["cuda -keys=cuda,gpu -max_num_threads=1024 -thread_warp_size=32", "tutorial/conv2d_no_batching", [1, 7, 7, 512, 512, 3, 3, [1, 1], [1, 1]], {}], "config": {"index": 4465579, "code_hash": null, "entity": [["tile_f", "sp", [-1, 1, 4, 1]], ["tile_y", "sp", [-1, 1, 7, 1]], ["tile_x", "sp", [-1, 1, 7, 1]], ["tile_rc", "sp", [-1, 8, 1]], ["tile_ry", "sp", [-1, 1, 3]], ["tile_rx", "sp", [-1, 3, 1]], ["auto_unroll_max_step", "ot", 1500], ["unroll_explicit", "ot", 0]]}, "result": [[0.0007488516470588235], 0, 1.4638090133666992, 1594554749.1748033], "version": 0.2, "tvm_version": "0.7.dev1"}
{"input": ["cuda -keys=cuda,gpu -max_num_threads=1024 -thread_warp_size=32", "tutorial/conv2d_no_batching", [1, 7, 7, 512, 512, 3, 3, [1, 1], [1, 1]], {}], "config": {"index": 3884824, "code_hash": null, "entity": [["tile_f", "sp", [-1, 1, 2, 2]], ["tile_y", "sp", [-1, 1, 7, 1]], ["tile_x", "sp", [-1, 1, 7, 1]], ["tile_rc", "sp", [-1, 8, 1]], ["tile_ry", "sp", [-1, 1, 3]], ["tile_rx", "sp", [-1, 1, 1]], ["auto_unroll_max_step", "ot", 1500], ["unroll_explicit", "ot", 0]]}, "result": [[0.0008426598833333333], 0, 1.5014281272888184, 1594554749.905856], "version": 0.2, "tvm_version": "0.7.dev1"}
{"input": ["cuda -keys=cuda,gpu -max_num_threads=1024 -thread_warp_size=32", "tutorial/conv2d_no_batching", [1, 7, 7, 512, 512, 3, 3, [1, 1], [1, 1]], {}], "config": {"index": 4659225, "code_hash": null, "entity": [["tile_f", "sp", [-1, 2, 2, 2]], ["tile_y", "sp", [-1, 1, 7, 1]], ["tile_x", "sp", [-1, 1, 7, 1]], ["tile_rc", "sp", [-1, 8, 1]], ["tile_ry", "sp", [-1, 1, 1]], ["tile_rx", "sp", [-1, 1, 3]], ["auto_unroll_max_step", "ot", 1500], ["unroll_explicit", "ot", 0]]}, "result": [[0.0003799742857142857], 0, 1.8095147609710693, 1594554750.8511684], "version": 0.2, "tvm_version": "0.7.dev1"}
{"input": ["cuda -keys=cuda,gpu -max_num_threads=1024 -thread_warp_size=32", "tutorial/conv2d_no_batching", [1, 7, 7, 512, 512, 3, 3, [1, 1], [1, 1]], {}], "config": {"index": 3690967, "code_hash": null, "entity": [["tile_f", "sp", [-1, 1, 8, 1]], ["tile_y", "sp", [-1, 7, 1, 1]], ["tile_x", "sp", [-1, 1, 7, 1]], ["tile_rc", "sp", [-1, 8, 1]], ["tile_ry", "sp", [-1, 3, 1]], ["tile_rx", "sp", [-1, 1, 1]], ["auto_unroll_max_step", "ot", 1500], ["unroll_explicit", "ot", 0]]}, "result": [[0.00041129317676767674], 0, 1.8487448692321777, 1594554751.7456198], "version": 0.2, "tvm_version": "0.7.dev1"}
{"input": ["cuda -keys=cuda,gpu -max_num_threads=1024 -thread_warp_size=32", "tutorial/conv2d_no_batching", [1, 7, 7, 512, 512, 3, 3, [1, 1], [1, 1]], {}], "config": {"index": 1949667, "code_hash": null, "entity": [["tile_f", "sp", [-1, 1, 8, 1]], ["tile_y", "sp", [-1, 1, 7, 1]], ["tile_x", "sp", [-1, 1, 1, 7]], ["tile_rc", "sp", [-1, 8, 1]], ["tile_ry", "sp", [-1, 3, 1]], ["tile_rx", "sp", [-1, 1, 1]], ["auto_unroll_max_step", "ot", 512], ["unroll_explicit", "ot", 0]]}, "result": [[0.00024290480572289154], 0, 1.7403113842010498, 1594554752.764843], "version": 0.2, "tvm_version": "0.7.dev1"}
{"input": ["cuda -keys=cuda,gpu -max_num_threads=1024 -thread_warp_size=32", "tutorial/conv2d_no_batching", [1, 7, 7, 512, 512, 3, 3, [1, 1], [1, 1]], {}], "config": {"index": 7176867, "code_hash": null, "entity": [["tile_f", "sp", [-1, 1, 8, 1]], ["tile_y", "sp", [-1, 1, 7, 1]], ["tile_x", "sp", [-1, 1, 1, 7]], ["tile_rc", "sp", [-1, 8, 1]], ["tile_ry", "sp", [-1, 3, 1]], ["tile_rx", "sp", [-1, 1, 1]], ["auto_unroll_max_step", "ot", 512], ["unroll_explicit", "ot", 1]]}, "result": [[0.00022418508192090396], 0, 1.8455100059509277, 1594554753.7573526], "version": 0.2, "tvm_version": "0.7.dev1"}
{"input": ["cuda -keys=cuda,gpu -max_num_threads=1024 -thread_warp_size=32", "tutorial/conv2d_no_batching", [1, 7, 7, 512, 512, 3, 3, [1, 1], [1, 1]], {}], "config": {"index": 2142424, "code_hash": null, "entity": [["tile_f", "sp", [-1, 1, 2, 2]], ["tile_y", "sp", [-1, 1, 7, 1]], ["tile_x", "sp", [-1, 1, 7, 1]], ["tile_rc", "sp", [-1, 8, 1]], ["tile_ry", "sp", [-1, 1, 3]], ["tile_rx", "sp", [-1, 1, 1]], ["auto_unroll_max_step", "ot", 512], ["unroll_explicit", "ot", 0]]}, "result": [[0.0008348939833333333], 0, 1.517810583114624, 1594554754.411723], "version": 0.2, "tvm_version": "0.7.dev1"}
{"input": ["cuda -keys=cuda,gpu -max_num_threads=1024 -thread_warp_size=32", "tutorial/conv2d_no_batching", [1, 7, 7, 512, 512, 3, 3, [1, 1], [1, 1]], {}], "config": {"index": 2723170, "code_hash": null, "entity": [["tile_f", "sp", [-1, 1, 2, 1]], ["tile_y", "sp", [-1, 1, 7, 1]], ["tile_x", "sp", [-1, 1, 7, 1]], ["tile_rc", "sp", [-1, 8, 1]], ["tile_ry", "sp", [-1, 1, 3]], ["tile_rx", "sp", [-1, 3, 1]], ["auto_unroll_max_step", "ot", 512], ["unroll_explicit", "ot", 0]]}, "result": [[0.0006724175165562915], 0, 1.5207750797271729, 1594554755.1223435], "version": 0.2, "tvm_version": "0.7.dev1"}
{"input": ["cuda -keys=cuda,gpu -max_num_threads=1024 -thread_warp_size=32", "tutorial/conv2d_no_batching", [1, 7, 7, 512, 512, 3, 3, [1, 1], [1, 1]], {}], "config": {"index": 2916825, "code_hash": null, "entity": [["tile_f", "sp", [-1, 2, 2, 2]], ["tile_y", "sp", [-1, 1, 7, 1]], ["tile_x", "sp", [-1, 1, 7, 1]], ["tile_rc", "sp", [-1, 8, 1]], ["tile_ry", "sp", [-1, 1, 1]], ["tile_rx", "sp", [-1, 1, 3]], ["auto_unroll_max_step", "ot", 512], ["unroll_explicit", "ot", 0]]}, "result": [[0.0006088514248120302], 0, 1.7730333805084229, 1594554756.1203296], "version": 0.2, "tvm_version": "0.7.dev1"}
{"input": ["cuda -keys=cuda,gpu -max_num_threads=1024 -thread_warp_size=32", "tutorial/conv2d_no_batching", [1, 7, 7, 512, 512, 3, 3, [1, 1], [1, 1]], {}], "config": {"index": 3884825, "code_hash": null, "entity": [["tile_f", "sp", [-1, 2, 2, 2]], ["tile_y", "sp", [-1, 1, 7, 1]], ["tile_x", "sp", [-1, 1, 7, 1]], ["tile_rc", "sp", [-1, 8, 1]], ["tile_ry", "sp", [-1, 1, 3]], ["tile_rx", "sp", [-1, 1, 1]], ["auto_unroll_max_step", "ot", 1500], ["unroll_explicit", "ot", 0]]}, "result": [[0.0006150577076923077], 0, 1.7717311382293701, 1594554757.082602], "version": 0.2, "tvm_version": "0.7.dev1"}
{"input": ["cuda -keys=cuda,gpu -max_num_threads=1024 -thread_warp_size=32", "tutorial/conv2d_no_batching", [1, 7, 7, 512, 512, 3, 3, [1, 1], [1, 1]], {}], "config": {"index": 9886424, "code_hash": null, "entity": [["tile_f", "sp", [-1, 1, 2, 2]], ["tile_y", "sp", [-1, 1, 7, 1]], ["tile_x", "sp", [-1, 1, 7, 1]], ["tile_rc", "sp", [-1, 8, 1]], ["tile_ry", "sp", [-1, 1, 1]], ["tile_rx", "sp", [-1, 1, 3]], ["auto_unroll_max_step", "ot", 1500], ["unroll_explicit", "ot", 1]]}, "result": [[0.0005999355119047619], 0, 1.6996958255767822, 1594554757.9566996], "version": 0.2, "tvm_version": "0.7.dev1"}
{"input": ["cuda -keys=cuda,gpu -max_num_threads=1024 -thread_warp_size=32", "tutorial/conv2d_no_batching", [1, 7, 7, 512, 512, 3, 3, [1, 1], [1, 1]], {}], "config": {"index": 1953187, "code_hash": null, "entity": [["tile_f", "sp", [-1, 1, 8, 1]], ["tile_y", "sp", [-1, 1, 7, 1]], ["tile_x", "sp", [-1, 1, 1, 7]], ["tile_rc", "sp", [-1, 16, 1]], ["tile_ry", "sp", [-1, 3, 1]], ["tile_rx", "sp", [-1, 1, 1]], ["auto_unroll_max_step", "ot", 512], ["unroll_explicit", "ot", 0]]}, "result": [[0.0002600285137318255], 0, 1.6625332832336426, 1594554758.963803], "version": 0.2, "tvm_version": "0.7.dev1"}
{"input": ["cuda -keys=cuda,gpu -max_num_threads=1024 -thread_warp_size=32", "tutorial/conv2d_no_batching", [1, 7, 7, 512, 512, 3, 3, [1, 1], [1, 1]], {}], "config": {"index": 7175767, "code_hash": null, "entity": [["tile_f", "sp", [-1, 1, 8, 1]], ["tile_y", "sp", [-1, 7, 1, 1]], ["tile_x", "sp", [-1, 1, 7, 1]], ["tile_rc", "sp", [-1, 8, 1]], ["tile_ry", "sp", [-1, 3, 1]], ["tile_rx", "sp", [-1, 1, 1]], ["auto_unroll_max_step", "ot", 512], ["unroll_explicit", "ot", 1]]}, "result": [[0.00037706684345794396], 0, 1.6851322650909424, 1594554761.6348662], "version": 0.2, "tvm_version": "0.7.dev1"}
{"input": ["cuda -keys=cuda,gpu -max_num_threads=1024 -thread_warp_size=32", "tutorial/conv2d_no_batching", [1, 7, 7, 512, 512, 3, 3, [1, 1], [1, 1]], {}], "config": {"index": 1174424, "code_hash": null, "entity": [["tile_f", "sp", [-1, 1, 2, 2]], ["tile_y", "sp", [-1, 1, 7, 1]], ["tile_x", "sp", [-1, 1, 7, 1]], ["tile_rc", "sp", [-1, 8, 1]], ["tile_ry", "sp", [-1, 1, 1]], ["tile_rx", "sp", [-1, 1, 3]], ["auto_unroll_max_step", "ot", 0], ["unroll_explicit", "ot", 0]]}, "result": [[0.0005977841369047619], 0, 1.4572651386260986, 1594554762.5201032], "version": 0.2, "tvm_version": "0.7.dev1"}
{"input": ["cuda -keys=cuda,gpu -max_num_threads=1024 -thread_warp_size=32", "tutorial/conv2d_no_batching", [1, 7, 7, 512, 512, 3, 3, [1, 1], [1, 1]], {}], "config": {"index": 980779, "code_hash": null, "entity": [["tile_f", "sp", [-1, 1, 4, 1]], ["tile_y", "sp", [-1, 1, 7, 1]], ["tile_x", "sp", [-1, 1, 7, 1]], ["tile_rc", "sp", [-1, 8, 1]], ["tile_ry", "sp", [-1, 1, 3]], ["tile_rx", "sp", [-1, 3, 1]], ["auto_unroll_max_step", "ot", 0], ["unroll_explicit", "ot", 0]]}, "result": [[0.0007428909903381642], 0, 1.5762028694152832, 1594554763.4755518], "version": 0.2, "tvm_version": "0.7.dev1"}
{"input": ["cuda -keys=cuda,gpu -max_num_threads=1024 -thread_warp_size=32", "tutorial/conv2d_no_batching", [1, 7, 7, 512, 512, 3, 3, [1, 1], [1, 1]], {}], "config": {"index": 1952087, "code_hash": null, "entity": [["tile_f", "sp", [-1, 1, 8, 1]], ["tile_y", "sp", [-1, 7, 1, 1]], ["tile_x", "sp", [-1, 1, 7, 1]], ["tile_rc", "sp", [-1, 16, 1]], ["tile_ry", "sp", [-1, 3, 1]], ["tile_rx", "sp", [-1, 1, 1]], ["auto_unroll_max_step", "ot", 512], ["unroll_explicit", "ot", 0]]}, "result": [[0.00036484932727272725], 0, 1.2898895740509033, 1594554764.197306], "version": 0.2, "tvm_version": "0.7.dev1"}
{"input": ["cuda -keys=cuda,gpu -max_num_threads=1024 -thread_warp_size=32", "tutorial/conv2d_no_batching", [1, 7, 7, 512, 512, 3, 3, [1, 1], [1, 1]], {}], "config": {"index": 3692067, "code_hash": null, "entity": [["tile_f", "sp", [-1, 1, 8, 1]], ["tile_y", "sp", [-1, 1, 7, 1]], ["tile_x", "sp", [-1, 1, 1, 7]], ["tile_rc", "sp", [-1, 8, 1]], ["tile_ry", "sp", [-1, 3, 1]], ["tile_rx", "sp", [-1, 1, 1]], ["auto_unroll_max_step", "ot", 1500], ["unroll_explicit", "ot", 0]]}, "result": [[0.0002756941145299145], 0, 1.699477195739746, 1594554765.1304386], "version": 0.2, "tvm_version": "0.7.dev1"}
{"input": ["cuda -keys=cuda,gpu -max_num_threads=1024 -thread_warp_size=32", "tutorial/conv2d_no_batching", [1, 7, 7, 512, 512, 3, 3, [1, 1], [1, 1]], {}], "config": {"index": 4655705, "code_hash": null, "entity": [["tile_f", "sp", [-1, 2, 2, 2]], ["tile_y", "sp", [-1, 1, 7, 1]], ["tile_x", "sp", [-1, 1, 7, 1]], ["tile_rc", "sp", [-1, 4, 1]], ["tile_ry", "sp", [-1, 1, 1]], ["tile_rx", "sp", [-1, 1, 3]], ["auto_unroll_max_step", "ot", 1500], ["unroll_explicit", "ot", 0]]}, "result": [[0.0004292866738197425], 0, 1.4198479652404785, 1594554765.83065], "version": 0.2, "tvm_version": "0.7.dev1"}
{"input": ["cuda -keys=cuda,gpu -max_num_threads=1024 -thread_warp_size=32", "tutorial/conv2d_no_batching", [1, 7, 7, 512, 512, 3, 3, [1, 1], [1, 1]], {}], "config": {"index": 4080130, "code_hash": null, "entity": [["tile_f", "sp", [-1, 1, 2, 1]], ["tile_y", "sp", [-1, 1, 7, 1]], ["tile_x", "sp", [-1, 1, 1, 1]], ["tile_rc", "sp", [-1, 16, 1]], ["tile_ry", "sp", [-1, 1, 1]], ["tile_rx", "sp", [-1, 3, 1]], ["auto_unroll_max_step", "ot", 1500], ["unroll_explicit", "ot", 0]]}, "result": [[0.0023376437906976744], 0, 1.8472495079040527, 1594554766.599286], "version": 0.2, "tvm_version": "0.7.dev1"}
{"input": ["cuda -keys=cuda,gpu -max_num_threads=1024 -thread_warp_size=32", "tutorial/conv2d_no_batching", [1, 7, 7, 512, 512, 3, 3, [1, 1], [1, 1]], {}], "config": {"index": 2337730, "code_hash": null, "entity": [["tile_f", "sp", [-1, 1, 2, 1]], ["tile_y", "sp", [-1, 1, 7, 1]], ["tile_x", "sp", [-1, 1, 1, 1]], ["tile_rc", "sp", [-1, 16, 1]], ["tile_ry", "sp", [-1, 1, 1]], ["tile_rx", "sp", [-1, 3, 1]], ["auto_unroll_max_step", "ot", 512], ["unroll_explicit", "ot", 0]]}, "result": [[0.002340719194029851], 0, 1.9041287899017334, 1594554767.5399392], "version": 0.2, "tvm_version": "0.7.dev1"}
{"input": ["cuda -keys=cuda,gpu -max_num_threads=1024 -thread_warp_size=32", "tutorial/conv2d_no_batching", [1, 7, 7, 512, 512, 3, 3, [1, 1], [1, 1]], {}], "config": {"index": 8919267, "code_hash": null, "entity": [["tile_f", "sp", [-1, 1, 8, 1]], ["tile_y", "sp", [-1, 1, 7, 1]], ["tile_x", "sp", [-1, 1, 1, 7]], ["tile_rc", "sp", [-1, 8, 1]], ["tile_ry", "sp", [-1, 3, 1]], ["tile_rx", "sp", [-1, 1, 1]], ["auto_unroll_max_step", "ot", 1500], ["unroll_explicit", "ot", 1]]}, "result": [[0.0002335953932748538], 0, 2.2125489711761475, 1594554768.5534341], "version": 0.2, "tvm_version": "0.7.dev1"}
